{"decoded_sample_count":80000,"decoded_sample_rate":48000,"decoder_id":"ffmpeg","decoder_version":"7.1.1","encoded_source_sha256":"aaaaaaaaaaaaaaaaaaaaaaaaaaaaaaaaaaaaaaaaaaaaaaaaaaaaaaaaaaaaaaaa","encoder_delay_samples":1024,"encoder_padding_samples":0,"kind":"SOURCE_PRESENTATION_MAP_V1","leading_trim_samples":1024,"probe_id":"ffprobe","probe_version":"7.1.1","schema_version":1,"segments":[{"presentation_end_us":1000000,"presentation_start_us":0,"source_start_sample":1024},{"presentation_end_us":2000000,"presentation_start_us":1500000,"source_start_sample":49024}],"trailing_trim_samples":0}