{
  "schema_version": 1,
  "kind": "SOURCE_PRESENTATION_MAP_V1",
  "encoded_source_sha256": "ffffffffffffffffffffffffffffffffffffffffffffffffffffffffffffffff",
  "decoded_sample_rate": 44100,
  "decoded_sample_count": 100000,
  "decoder_id": "ffmpeg",
  "decoder_version": "7.1.1",
  "probe_id": "ffprobe",
  "probe_version": "7.1.1",
  "leading_trim_samples": 576,
  "trailing_trim_samples": 1152,
  "encoder_delay_samples": 576,
  "encoder_padding_samples": 1152,
  "segments": [
    {"presentation_start_us": 0, "presentation_end_us": 1500000, "source_start_sample": 576},
    {"presentation_start_us": 1500000, "presentation_end_us": 2000000, "source_start_sample": 66726}
  ]
}
